id_a,id_b,text_a,text_b,rating_a,rating_b,expected
5464,2165,me: so do they let you start off on the jack hammer or do you have to b- construction worker: dude i said fuck off me: [waits 10 seconds] or do you have to 'build' up to that,"I asked my wife if I was the only one she's been with. She said, ""Yes, the others were at least sevens or eights"".",1.55,3.3,B
3429,2392,"I got fired when I asked a customer if he preferred smoking or non smoking. Apparently, the correct terms are 'cremation' and 'burial'.",I think more people used the word “shitshow” tonight than in the history of the word,3.15,0.83,A
1133,3764,"Husband says to his wife ""what would you do if I won the lottery?"" She replied ""I'd take the half and leave you."" ""great"" he said, ""I won 12$, here's 6$, stay in touch.""",What's orange and sounds like a parrot? A carrot.,3.15,1.5,A
6770,2418,I remember my teacher telling me that looking out of the window wouldn't get me anywhere. Did I have a smug look on my face when I handed him his big mac and fries at the drive through.,Give a white man a fish and he'll eat for a day. Give a black man a fishing rod and he'll fish your car keys through your letterbox.,2.63,1.28,A
3055,895,What do you call a Muslim optician who doesn't give a fuck about his patients? Asif Eyecare,What's the difference between pussy and mashed potatoes Mashed potatoes don't make their own gravy,2.5,1.4,A
1452,1770,"Twitter always says I should follow celebrities, but I wonder if it ever suggests they follow me, like ""here, follow this random ugly guy""",Misspell one word and the whole text is urined,2.55,3.79,B
5597,2001,My wife caught me cheating last night and i feel so ashamed and full of regret. She's never going to play monopoly with me again!,"A German man and woman are having sex, and an American walks in... The American shouts ""Gross!"" and turns away. The German man looks toward him and smiles, saying ""Danke!""",3.55,1.25,A
7162,18,"My Dad got a new pair of pants. When I asked him how they fit, he said, ""like a cheap castle"". When I looked confused he said, ""no ballroom""","You can make any sentence creepier by adding ""consenting"" to it. ""Just two consenting adults, riding a tandem kayak.""",3.4,1.78,A
1796,5663,Kim Petras on Sept 30th: woo ah! Kim Petras on Oct 1st: boo ah!,When a transgender goes missing.. You put their photo on a carton of Half and Half.,0.69,2.35,B
3759,7944,My girlfriend hates when I make jokes about her weight. She needs to lighten up.,It's weird that my therapy dog has no interest in hearing about my childhood.,2.3,3.3,B
3423,5425,"YOU: I don't understand kids these days. Me: [equipped with the knowledge that comes after 46 years of studying anthropology, sociology, child psychology, and global culture] They like doing that fortnite dance.",A man knocked on my door and asked for a small donation towards the local swimming pool. I gave him a glass of water.,2.11,3.2,B
1427,4810,You would think that a Snail without a shell would move that bit faster? But it's actually more sluggish.,What do people call their grandmother in India? Naana,3.0,1.87,A
7123,3469,ME AT 13: It's really weird that owls cough up pellets. ME AT 31: [waking up in a cold sweat] Does that mean owls don't have butts?,A thief broke into my house last night looking for money. So I got out of bed to look with him.,1.42,3.53,B
7363,7427,My son is now at that age where he's curious about the human body. I guess I'll have to hide it somewhere else now.,The Job Promotion Saudi Arabia just announced that someone was promoted be the new Oil Minister. That would make it a sheikh-up in the government.,3.05,1.65,A
4559,5279,I just found out that my new electric toothbrush is not waterproof. I was shocked.,I've got 99 problems and bottles of beer on the wall are all of them.,3.15,2.1,A
1170,5780,What do you call your Mexican crush? Juan Andonle,I'm allergic to bread but eat it anyway. I'm a gluten for punishment.,0.94,3.05,B
1061,497,"Every morning after I get out of the house, a bike comes out of nowhere and runs me over. It's a vicious cycle.","To the Dads out there: today and all days, may your Dockers be wrinkle-free.",3.3,1.87,A
750,2340,"Everybody's a gangster until they get punched in the mouth - Mike Tyson And after that, everybody's a gangthter.",why should you never pick a fight with an Israeli baker? Because they know Jew dough,2.89,1.6,A
7293,1197,"I walked in on my girlfriend having sex with her personal trainer. Me: ""Ok, this isn't working out.""",How do they separate the Men from the Boys in the Navy? With a crowbar. h,2.8,1.32,A
3676,3013,What did the elephant say to the naked man? How do you breathe through that tiny thing?,"The benefits of having kids include their cuteness, adorable cuddles, and using them being sick as an excuse to get out of absolutely anything you want.",3.55,2.3,A
2578,6033,"A Mexican magician tells the audience he is going to disappear on the count of 3. He says ""uno, dos..."" and POOF! He disappeared without a tres.",What did the cannibal choose as his last meal? Five guys.,3.53,2.1,A
2336,3466,"Someone told me you can find the Christmas story in the bible, but I just spent the last 2 hours looking and couldn't find anything about Santa anywhere","The police just pulled me over, he came up to my window and said, ""papers?"" I said, "" Scissors, I win"" and drove off. I think he wants a re-match he's been chasing me for 45 minutes.",1.79,3.1,B
3423,7151,"YOU: I don't understand kids these days. Me: [equipped with the knowledge that comes after 46 years of studying anthropology, sociology, child psychology, and global culture] They like doing that fortnite dance.","An elderly couple is in church. The wife says to the husband, ""I've let out one of those silent farts, what do I do?"" The husband says, ""Change the battery in your hearing aid.""",2.11,3.53,B
7630,3326,"Her: What do you do? Me: I race cars. Her: Do you win many races? Me: No, the cars are much faster.","We transitioned our toddler from his crib to a big boy bed today and I cried harder than he did, but at least I wasn't overly emotional about it.",2.35,1.0,A
3425,1558,"Twenty years ago: Is it because I is black? Yes, that is the reason you're being mistreated. Now: Is it because I is black? Yes, that is the reason you've been cast in a film role ahead of far more appropriate actors.",Q: Why do Mormon women stop having babies at 35? A: Because 36 would be too many.,1.13,2.2,B
4185,5484,What do you call a fruit that is a vegetable? A crippled homo.,"What did the dyslexic bank robber say when he robbed the bank? ""Air in the hands motherstickers! This is a fuck up!""",0.89,2.9,B
3807,3300,I try so hard not to upset my vegan girlfriend. I'm constantly treading on eggshells. Which she also doesn't approve of.,You know why we never see retarded black kids? Because God only punishes once.,3.05,1.29,A
4166,6308,"The home improvement shows never mention how when you start a renovation project, you'll not only have to rebuild your house but also your marriage.","me: [stops kissing] what's wrong her: this isn't what i meant when i asked if you had ""toys"" me: my bop it: bop it!",2.32,1.22,A
1607,1039,Weird situation based questions are great openers for approaching and starting conversations. Try asking where the train station is the next time you see a woman who catches your eye at the supermarket.,Alabama changed the drinking age to 34. They wanted to keep alcohol out of the high schools,1.8,3.21,B
6518,93,me: hi can I get the price on this target cashier: [rips fire extinguisher from my hands] walmart said you'd be coming,Brad Pitt should have his own line of deodorant called Brad's Pits,1.26,2.55,B
5640,6327,"me, walking: hello me, walking with coins in my pocket: howdy partner","If I were in prison, I wouldn't ruin my spoon trying to tunnel out, because going without morning yogurt is its own prison.",1.12,2.22,B
6104,4184,"Gay marriage will encourage people to be gay, in the same way that hanging around tall people will make you tall.","An Englishman, an Irishman and a Scotsman decided to have a BBQ. The Englishmen brought some meat, the Irishman brought some whiskey and the Scotsman brought some dude from Aberdeen.",2.5,1.2,A
3146,3486,I hate it when people don't know the difference between your and you're. There so stupid.,Why can't black people get their PhD? They can't get past their masters. rofl,3.0,1.85,A
4957,5588,"I asked my sister how her blind date went ""Oh it was terrible"" she said, ""He showed up in a 1948 Rolls-Royce."" ""So what's so bad about *that*?"" I asked. Apparently he was the original owner.",Great news: scientists have bred a turkey that tastes exactly like tofurkey.,3.47,1.67,A
5988,2391,The Invisible Man and The Invisible Woman got married. Their kids aren't anything to look at.,judas: that jesus guy really pisses me off lol me: haha what judas: sometimes i just wanna beat the shit out of him until he's an inch from death and nail him to a cross haha me: dude what,3.25,1.6,A
7372,3132,"Sadly I think my family are a bunch of racists. I started dating a black girl recently, so I decided to bring her home to meet the family. The kids wouldn't talk to her and my wife told me to pack my bags and leave.",What are french journalists good at catching? Bullets.,3.19,1.95,A
6433,4185,Never get in a fight with a T-rex. You'll get jurasskicked.,What do you call a fruit that is a vegetable? A crippled homo.,2.79,0.89,A
7528,7462,"My dog used to chase people on a bike a lot. It got so bad, finally I had to take his bike away. rofl","Husband says to his wife ""do you smell that"" wife says ""no?"" Husband says ""me neither so start cooking""",2.85,1.85,A
2193,1315,"I promise you, if you came to one Mexican party... racism would end!",Did you hear the one about the giant throwing up? It's all over town.,1.33,2.95,B
3379,6308,"My girlfriend left me for an Indian guy. It's okay, I know he's going to treat her well. I heard they worship cows","me: [stops kissing] what's wrong her: this isn't what i meant when i asked if you had ""toys"" me: my bop it: bop it!",2.7,1.22,A
1285,5980,The muslim kid I went to school with was always notoriously late for everything... We called him 9/12.,"My parents said that if I got a tattoo I'd have to get it in a place that didn't matter. So I got it in Buford, Wyoming.",1.74,2.89,B
265,4558,"What did the amputee say to his mom when he learned to ride a bike? Look ma, no hands!",NORAD tracking Santa? Really? That's what my tax dollars are going to? You're tracking a fictitious fat dude?,2.45,1.42,A
4658,2626,"I yelled at my girlfriend, ""If you continue stealing my cooking utensils, I'll move out!"" She just laughed and said... ""That's a whisk I'm willing to take!""",What do you call a gay avatar? A bender.,3.1,1.58,A
4708,3778,"My wife told me to take a spider out instead of killing it. We went and had drinks. Cool guy, wants to be a web designer.",What do you call a knight who is afraid to fight? Sir Render.,3.55,2.55,A
6767,6445,I was walking by a car filled with black people. They locked the door when i came near. I felt like a bad ass until I realized it was my car,What do you call an Arab man who drives a bus? A bus driver.,2.55,1.24,A
1039,5933,Alabama changed the drinking age to 34. They wanted to keep alcohol out of the high schools,What's the difference between a Mexican and an elevator? One can raise a child.,3.21,1.55,A
5983,6906,"I think therapy dogs make just about everyone feel better, except those people who wasted years of their lives going to school to become therapists only to be replaced by a chocolate lab with no education.",ME: We could all dunk if we lived on the moon because of the difference in gravity. MY FRIEND WHO NEVER HEARD OF BASKETBALL OR THE MOON BUT IS TRYING TO SPEND MORE TIME WITH ME BECAUSE HE FEELS GUILTY THAT WE FELL OUT OF TOUCH: Ha ha yeah man. Totally. It's so good to see you.,2.37,1.0,A
1679,3121,"I'd rather be a samurai than a ninja. You can be a badass samurai well into your 50s, but your career as a ninja is over the minute you hit your mid 30s and your bones start cracking when you walk",As soon as space travel is possible I'm moving from the Milky Way to the SoyMilky Way galaxy. I'm Galactose intolerant.,1.62,2.8,B
2787,1061,"[Starbucks] What can I get you? I'll have a large coffee, black ""You don't have to say black"" I'll have a large coffee, African American","Every morning after I get out of the house, a bike comes out of nowhere and runs me over. It's a vicious cycle.",1.75,3.3,B
834,6271,"To the haters on Twitter, if you don't like me or my tweets, I have an important message for you: Would 5 bucks change your mind? I need people to like me because it boosts my low self esteem.","I went to the bar last night and saw a really fat woman dancing on a table. I said, ""Good legs."" The girl giggled and said, ""Do you really think so?"" I said, ""Definitely! Most tables would have collapsed by now.""",1.87,3.05,B
1383,3481,A disabled woman's guide dog has just shit all over the footpath near my house. So I've done the responsible thing and proceeded to video her whilst she struggles to clean it up.,What's black and white and black and white and black and white and black and white? A Penguin rolling down a hill What's black and white and laughing? The penguin who pushed him,1.79,2.9,B
3771,3288,"In Hell, the radio is only the Kars for Kids commercials.","I keep my head held high because I know there's a beautiful deaf, mute & blind woman out there that's going to find me irresistible one day.",1.56,2.78,B
4731,4314,Coffee and Cocaine It seems the only reason Columbia exists is to wake the rest of the world up....,Eminem is afraid of giraffes. He doesn't like their necks.,2.2,0.4,A
7162,2360,"My Dad got a new pair of pants. When I asked him how they fit, he said, ""like a cheap castle"". When I looked confused he said, ""no ballroom""","When someone asks me how my day is, I like to say ""Still kinda pissed about Hiroshima,"" & then start swearing in Japanese.",3.4,1.63,A
7094,4106,"A pirate's wife asks him what body part he'd be most okay with losing The pirate thinks and replies, ""my spine!"" ""Why?"" says his wife, a little surprised ""Because it's holding me back!""","Careers Advisor to American student: ""What do you want to be when you leave college?"" Student: ""Alive"".",3.15,1.95,A
1187,3023,What do you call a cowshed in Arabic? A Mubarak,Q: What did the skunk use to contact his girlfriend? A: His smellular phone!,0.47,2.25,B
5482,4857,Accidentally swallowed some Scrabble tiles last night. My next shit could spell trouble,It's ironic the first thing blacks buy when they get money is a chain to put round their neck. They miss the good old days as much as we do.,3.0,1.19,A
7109,114,My girlfriend wanted to have a talk about how childish i am But she didn't have the secret password to my pillow fort so she couldn't get in,Time to fulfill my dream of marketing my own line of artisanal antifreeze.,3.1,1.59,A
5722,3881,What do you call an iguana that thinks it's a dog? A reptile dysfunction.,Heard a news story about a village in Africa where everyone's dying of thirst. I sent them a Get Well Soon card.,3.3,2.05,A
5239,5804,"I'll never forget my sons first words... ""Where the fuck have you been for 16 years""",What do you get when you cross an onion and a donkey? A piece of ass that brings a tear to your eye.,3.37,1.9,A
5036,5179,What's the difference between MLK day and St Patrick's day? Nobody minds being Irish for one day!!!!,Do you guys remember when I told you about my spine issue? It was about a week back.,1.58,2.89,B
1047,5628,I gave a blind man 10$ He told me he'll pay me back the next time he sees me.,"So I'm banging this guy from behind... ... and he turns around to kiss me, and I say ""Whoa, buddy. I'm not gay!""",2.95,1.85,A
3618,6849,What do you call an Asian penguin? A penguyen,"My kid wanted to get a pet spider from the pet store, but they are really expensive. I can get a really cheap one off the web.",1.65,3.05,B
5492,2502,I found a rock yesterday which measured 1760 yards in length.Must be some kind of milestone.,What do you call an Irish J-Pop singer? Rady O'Gaga,2.9,1.63,A
6507,3620,"Every morning at breakfast, I tell my family that I'm going for a jog, and then I don't. It's my longest running joke of the year.",I like my women the way I like my coffee in a basket being touched by many Colombian men.,2.95,1.84,A
111,5821,"Baby yoda = delight, ancient yoda = enchanting, teen yoda = friggin impossible",I just quit my job at the helium factory. I won't be spoken to in that tone.,1.0,3.45,B
3323,5077,"I was in a liquor store and an employee asked me ""Do you need help?"" I said ""Yes, but I'm going to get whiskey instead""",Good morning to ace twitter only,3.26,1.1,A
2628,6112,How do Japanese people refer to American politicians? Parti-san,"In an effort 2 squash some posers, my daughter is helping me start an Instagram profile. Chk it out. Hint: it's just my name",2.21,1.17,A
5173,4143,What do you get when you mix a Native American and an Irishman? An alcoholic with a drinking problem,Me: I bet I'd make a great superhero Also Me: (sees a family with car trouble parked on the side of the road) I'm sure someone else will help them,1.55,2.71,B
6906,7293,ME: We could all dunk if we lived on the moon because of the difference in gravity. MY FRIEND WHO NEVER HEARD OF BASKETBALL OR THE MOON BUT IS TRYING TO SPEND MORE TIME WITH ME BECAUSE HE FEELS GUILTY THAT WE FELL OUT OF TOUCH: Ha ha yeah man. Totally. It's so good to see you.,"I walked in on my girlfriend having sex with her personal trainer. Me: ""Ok, this isn't working out.""",1.0,2.8,B
2623,4788,"We need a tiny, classy hot dog -the inventor of the cocktail wiener","A dog is truly a man's best friend. If you don't believe it, just try this experiment. Lock your dog and your wife in the boot of the car for an hour. When you open the boot, which one is really happy to see you?",1.93,3.21,B
2074,7920,"when she says to go do something, don't really go and do it",My wife just tripped and fell while carrying a bunch of clothes she just ironed. I watched it all unfold.,1.38,2.47,B
3306,1187,God's Assistant: really? Leather wings on a mouse's body? I think you're just in a bad mood. God: ALSO MAKE IT BLIND AND SCREECHING,What do you call a cowshed in Arabic? A Mubarak,2.1,0.47,A
7418,4596,"A man filed a report to the police that his bag was stolen. Upon leaving the man's apartment, the officer found the man's bag at the bottom of the stairwell. It was a brief case.",The only reason why i am fat is because a tiny body could not store all this huge personality.,2.89,1.89,A
6476,7201,I refuse to listen to anyone give commentary on the state of society unless it's in a Facebook video filmed inside their car.,"A Tibetan monk sees the face of Jesus in a tub of margarine. He raises his eyes to the heavens and said: ""I can't believe it's not Buddha!""",2.06,3.2,B
7188,3493,"A policeman pulled me over and said... ""Do you know why I pulled you over?"" I said, ""Because you wanted to see how tall I am?"" ""Step out of the car sir,"" he ordered. I said, ""See, I told you!"" Pig cunt.","Earlier, I was driving behind an ambulance when a cooler fell off the back. I stopped and opened it up to find a foot inside.. So I called a toe-truck.",1.47,2.75,B
829,7160,I am amazing at managing my credit card. My bank keeps sending me letters saying my account is outstanding.,What does Arnold Schwarzenegger call a colonoscopy? A Cameron Diaz Say It Out Loud,3.1,0.56,A
7317,6578,What do lawyers wear to work? A lawsuit.,"Me: ""When I donate blood I do not extract it myself. A nurse does it for me."" Receptionist: ""Yes, but this is a sperm bank and it doesn't work that way.""",2.05,3.25,B
1061,6500,"Every morning after I get out of the house, a bike comes out of nowhere and runs me over. It's a vicious cycle.","I tried to order a Vietnamese sandwich at a restaurant today while I was walking around topless... The staff refused to serve me, and threatened to bahn mi if I came in without a shirt again.",3.3,1.65,A
537,915,What do you call a sad strawberry? A blueberry corny,I saw a man with one arm shopping at a second hand store. I told him: 'You're not going to find what you're looking for here.',0.74,3.05,B
1035,2859,Why do the French like to eat snails so much? They can't stand fast food.,Reminds me of scene from Jaws.... LOL,2.79,0.6,A
6678,4464,What was the jew doing in the ashtray? Family research.,Did you know vampires arent real? Unless you Count Dracula.,1.3,2.37,B
7970,7095,two knights fucking would sound like throwing a silverware drawer down the stairs,Whoever stole my anti depressants. I hope you're happy now.,2.3,3.75,B
2825,7241,My wife told me I'm not allowed to impersonate a flamingo anymore. I had to put my foot down.,Me: everyone loves the clever nicknames I come up with Divorced Parents Rhonda: not everyone,3.1,1.79,A
6862,205,I got into a fight with my erection this morning. I beat it single handedly.,"This girl I like said she didn't like bondage..... ....Me either, but you're the one who said No.",2.45,1.17,A
2948,3983,[first date] Her: I love cats Me: (trying to impress) *pushes her plate off the table*,Why was the transvestite always angry? cross-dressing,3.15,1.4,A
3669,7352,"I was having sex with a woman last night and she kept screaming this other guys name. Who the hell is this ""Rape"" fellow, anyway?",I buy my guns from a guy named T-Rex He's a small arms dealer.,1.85,3.5,B
6108,497,"It's frustrating when all the birthday cards at the store suck. Is it really too much to ask to be able to purchase a piece of cardboard with the exact words quantifying my very unique and very specific relationship with my wife for just $4.99? Get it together, Hallmark.","To the Dads out there: today and all days, may your Dockers be wrinkle-free.",3.35,1.87,A
7572,1223,What do you call a muslim sitting on a plane? A passenger,The airport lady at passport control saw I was American & warned me there were no McDonald's past security. I feel very profiled & grateful.,1.12,2.6,B
6383,4306,I can't sleep so I better keep everyone awake. - babies,"I was feeling horny and needed some relief. I asked my fat wife for sex and she said ""No"" You have no idea what a relief that was.",2.89,1.8,A
7654,1270,"A Down Syndrome walks into a bar. Barman says ""Why the mong face?""","If you think George R. R. Martin books are long, you should try reading a text from my mom",1.0,2.0,B
1039,733,Alabama changed the drinking age to 34. They wanted to keep alcohol out of the high schools,I'm headed out now to the record store to buy The Raconteurs' new album. Then I'm going to the pharmacy for a chocolate malt. I live in a small town in 1948.,3.21,2.14,A
4427,4607,me: [absolutely killing it on harmonica] taco bell cashier: are you gonna order,"WHAT DO WE WANT? ""Hearing aids."" ""WHEN DO WE WANT THEM?"" ""Hearing aids.""",1.94,3.47,B
1617,3018,We get it. You're Muslim. You don't have to Ramadan our throats.,How many Americans does it take to screw a lightbulb? None. Their President outsources the job to India.,1.67,2.85,B
4331,6649,I'm a practicing Catholic But I'm not ready to go pro just yet.,How do you know Adam and Eve weren't black? Have you ever tried to take a rib from a nigger?,2.6,1.5,A
7906,7638,"As we were driving down the road, ""Sweet Caroline"" came on the radio. I said to my son, ""Little known fact, Neil Diamond used to be called Neil Coal."" 'Until the pressure got to him.'",Do you think that all this poverty in Africa is just Gods way of saying that he didn't mean to create black people?,2.79,1.5,A
3481,5295,What's black and white and black and white and black and white and black and white? A Penguin rolling down a hill What's black and white and laughing? The penguin who pushed him,"I'm going skiing in Colorado. They say there are a lot of blacks there. But there are a lot of blues and greens as well, so I should be okay.",2.9,1.3,A
6640,5768,Walking into a fro-yo shop is probably what it's like walking into a Japanese girl's purse.,I saw a Jewish Ghost last night... It was so scary I started to Shiva.,0.68,2.1,B
1187,1506,What do you call a cowshed in Arabic? A Mubarak,"I'm giving up drinking for a month. Sorry, that came out completely wrong. I'm giving up. Drinking for a month!!",0.47,2.8,B
4248,4562,"ME: What has skin, and eyes, but no heart? LINDA: Um, a potato? ME: Close, Linda, close. *I hand Linda a picture of her kissing my best friend*",Tinder is the Night' Update A Fitzgerald Novel Hashtags With Only One Response,2.0,0.7,A
1133,1503,"Husband says to his wife ""what would you do if I won the lottery?"" She replied ""I'd take the half and leave you."" ""great"" he said, ""I won 12$, here's 6$, stay in touch.""",Why are there no black astronauts... Is there any cotton on the moon?,3.15,1.53,A
3229,1978,"*Lady gives balloon to my son* ME: What do u say? SON: I WILL CRUSH MY ENEMIES ME: *nervous laughter* No, the other thing SON: Oh. Thank you","My Vietnamese friends just got married. They have the same common last name, so neither of them needed to change anything. You could say it's a Nguyen-Nguyen situation.",1.95,3.2,B
175,3811,I got thrown out a strip club last night for using monopoly money. I don't see why I should pay real money to see fake boobs.,Being fat is when you watch Jurassic Park and wonder if dinosaur tastes good.,3.25,1.85,A
4051,1481,"A girl in a restaurant asked me ""Are you single?"". I happily replied ""Yes"". She took away the extra chair in front of me.",Why don't vampires bet on horses? They can't handle the stakes.,3.35,2.2,A
