id_a,id_b,text_a,text_b,rating_a,rating_b,expected
3668,5689,Whats the hardest part about cooking vegetables? Fitting the wheel chain in the oven.,"Yesterday I was washing the car with my son. He goes 'Dad, why can't you just use a sponge?'",1.05,2.4,B
4060,1151,What do you call a superhero with a bad sense of direction? Wander woman.,"Today my son asked, ""Can you lend me a book mark?"" I immediately burst into tears. 12 years old and he doesn't know my name is Brian",1.95,2.95,B
1248,3187,I told my dad to embrace his mistakes. He cried. Then he hugged me and my brother.,"What did the fat pig say when the farmer  dumped corn mash into the trough? ""I'm afraid that's all going to waist.""",3.39,2.35,A
750,1118,"Everybody's a gangster until they get punched in the mouth - Mike Tyson And after that, everybody's a gangthter.",What do you call a cute homeless girl? Dust Bunny,2.89,1.75,A
7356,6520,What's an astronaut's favorite part of a computer? The space bar.,"""I'm arresting you for carrying a knife"" said the Police officer. 'Is it 'cos I is black?"" I replied ""No"" replied the Policeman ""what makes you think that?"" ""Cos I'm in ma own kitchen and I've just taken it out of the dishwasher""",2.75,1.7,A
5384,1675,I'm a compromise conspiracy theorist. I believe Neil Armstrong walked on the moon and Buzz Aldrin didn't.,Fortune Nookie. Classic,2.62,0.67,A
5043,6557,Only ten more American gun massacres until christmas,One of the ants on my ant farm dresses up as a clown to cheer up his friends. He's an anti-depress ant.,1.94,3.1,B
1522,4468,The only tan I'm getting this summer is a caftan!* *Excerpted from my Golden Girls spec script.,Where does a Jewish farmer become a man? At his Barn Mitzvah,1.62,2.67,B
5226,7540,What do you call a Jew with a pH lower than 7? ....hasidic I'll let myself out now. I know that was matzo good...,"How my day went today 1. Woke up 2. Went to work 3. Saw hot girl 4. Kissed the girl Too bad it happened in the order 2,3,4,1.",1.47,2.58,B
4350,6108,Relationships are about compromise. I pretend she's not watching a Gossip Girl boxset. She pretends I'm not digging her grave in the garden.,"It's frustrating when all the birthday cards at the store suck. Is it really too much to ask to be able to purchase a piece of cardboard with the exact words quantifying my very unique and very specific relationship with my wife for just $4.99? Get it together, Hallmark.",1.9,3.35,B
4700,5337,Waiting at the vet's office for my dog to get his shots. Might let the guy in the beard of wasps go ahead of me.,"For the past few days, I wake up to see someone has dumped a bunch of LEGO blocks on my front porch. I don't know what to make of it.",1.47,2.71,B
5246,6235,Did you hear about the Yacht builder that had to work from home? His sails went through the roof.,"We all make fun of it, but how creepy would it be if we suddenly STOPPED getting e-mails from LinkedIn?",3.05,1.33,A
5761,4691,My doctor wrote me a prescription for dailysex but my girlfriend insists it says dyslexia,"""Now, Madam, can you describe the man who stole your handbag?"" ""Oh, it all happened so fast! He pushed me over from behind, I didn't see him at all. One thing though; he was a vegan."" ""How do you know that?"" ""He told me as he was running off.""",2.8,1.4,A
1474,2620,My obese parrot died It was a real weight off of my shoulder,"Why do people say ""fat people are lazy""? Fat people get themselves food, I'm skinny because I'm too lazy to get myself food.",3.25,2.15,A
1714,6557,"I never thought I'd say this, but can we stop arguing about politics on Facebook and go back to trying to convince each other how great our lives are?",One of the ants on my ant farm dresses up as a clown to cheer up his friends. He's an anti-depress ant.,2.08,3.1,B
1697,280,Did you know you are supposed to pull anal beads out slowly? I didn't... I started the wife up like a f*cking chainsaw.,My wife just gave birth to a ginger baby. We've shaved it's head and told everyone it has cancer.,2.79,1.65,A
3140,672,What do you call a cold Jewish person? Iceberg.,"MY DAD: You'll take care of me when I get older, right? ME: [Thinking about when I was little and he used to scrub the shampoo into my hair too hard] We'll see.",1.5,2.58,B
108,7931,"Someone is suing Canada Dry Ginger Ale because it contains no ginger, so I'd like to formally announce my lawsuit against Panda Express.",Why are most Muslims broke all the time? They never understood the concept of piggy banks.,2.75,1.74,A
3732,1545,"Sadly, I've lost 20% of my sight. Sigh","A man and a woman walk into an elevator The man asks the woman, can I smell your feet? The woman looks at him with disgust and says no. The man says, it must be your vagina then.",2.8,1.7,A
5705,3288,Waiter: welcome to Spaghetti Surprise Me: 1 spaghetti please Waiter: we don't sell that Me: oh now I get the name Waiter: surprise,"I keep my head held high because I know there's a beautiful deaf, mute & blind woman out there that's going to find me irresistible one day.",1.68,2.78,B
2410,2507,"My dad once told me that if I put a potato in my swim trunks, I would attract more women... He forgot to tell me to put the potato in the front.",What happens when a Chinese man with a boner runs into a wall? He breaks his nose.,3.35,1.95,A
1992,7850,They are re-releasing Avengers: Endgame with extra footage of Disney executives swimming in money.,"After winning the game, I decided to throw the ball to the spectators. Apparently that's frowned upon in bowling.",2.0,3.15,B
5325,1770,Life insurance? Why? So my wife's new boyfriend can get a trampoline?,Misspell one word and the whole text is urined,2.7,3.79,B
2632,1211,"My wife said to me: ""If you won the lottery, would you still love me?"" I said: ""Of course I would. I'd miss you, but I'd still love you.""",god: [watching my life] oh this guy's definitely getting into heaven me: [waves goodbye to my poop as i flush] god: wait,3.25,1.78,A
6759,5681,Did you know Hitler's father was a cobbler? He made Jews.,"""Do you think I reference dinosaurs too much when I write?"" I asked. She was silent, like the p in pterodactyl, but it said everything.",1.11,2.72,B
3726,4657,"""Here's a few magazines to get you started"" 1. If you're European, something you might hear in a sperm bank.... 2. If you're American, something you might hear on your way to school...",A fun activity at the rodeo is walking around asking people if it's their first rodeo. It never gets old.,1.12,2.32,B
6258,3722,Smell is such an amazing trigger for memories. Like how the smell of pizza can instantly transport you back to a time you ate pizza. Incredible.,If you call someone from America American and someone from Mexico Mexican what do you call someone from Tibet? Chinese,2.73,1.31,A
4791,4802,What do you call a hen who counts her eggs? A mathemachicken.,"I was talking to a girl in the bar last night. She said, ""If you lost a few pounds, had a shave and got your hair cut, you 'd look all right."" I said ""If I did that, I'd be talking to your friends over there instead of you.""",2.15,3.35,B
7813,7021,"I Wasn't Too Keen On The Idea Of Gay Parenting Until I met my wife, who was raised by two dads. That's when I came to my senses and realized.. NO MOTHER-IN-LAW!","PROFESSOR X: what exactly is your mutant power? *I whisper ""it's not very good"" in his left ear but he hears it in his right ear*",3.42,2.21,A
5112,1154,"Yo mama so fat, when she went to Hogwarts for the first time, the sorting hat said ""Awwwwww hell 'naw!!""","Today I shocked the hell out of the mailman by opening the door completely naked. I'm not sure what surprised him most: my nudity, or the fact that I know where he lives.",1.35,3.0,B
2528,7784,Did you hear about the guy that was half Black and half Japanese ... ... every December 7th he would attack Pearl Bailey.,What do you call one white guy surrounded by 10 black guys? Coach. What do you call one white guy surrounded by 100 black guys? Warden.,1.45,2.6,B
1721,573,The most unrealistic part of action movies is where the hero puts his kids to bed and they go to sleep right away.,Why are black peoples palms white? Because there's a little bit of good in everyone.,2.68,1.45,A
7440,4596,"Life hack: If you run out of breadcrumbs for a recipe, turn your computer keyboard over and shake it.",The only reason why i am fat is because a tiny body could not store all this huge personality.,3.0,1.89,A
792,2525,Me: it hurts when I do this Doctor: sit on a table? Me: no share a room with the man my wife is sleeping with *the silence is a new pain*,Don't be worried about your smartphone or TV spying on you. Your vacuum cleaner has been gathering dirt on you for years.,1.84,2.95,B
7075,6812,"Why does Germany have so many different kinds of bread? Well, we had to do something with the ovens.",[first date] Her: I like sensitive men Me: (trying to impress) That offends me,1.68,2.74,B
6749,5112,Pandas are proof that you can get fat from just eating salad.,"Yo mama so fat, when she went to Hogwarts for the first time, the sorting hat said ""Awwwwww hell 'naw!!""",2.5,1.35,A
51,2443,"In 2018, a Missouri deer poacher was ordered to watch ""Bambi"" once a month for the entirety of his year-long prison sentence.","My girlfriend is weird, she always starts conversations with, ""Are you even listening to me!""",1.71,3.0,B
3308,2779,Just witnessed a white girl take a selfie with her coffee in Starbucks. I always heard the legends but never thought I'd see it in the wild.,"My wife says she's leaving me because of my obsession with karaoke. I said ""Fine, go on now go, walk out the door, just turn around now, because your not welcome anymore....""",1.4,2.67,B
4712,134,I'm tired of people telling me to turn off my lights to save the environment. I did it once and killed a cyclist.,My Wife and I were blissfully happy for 25 magical years.. And then we met...,2.21,3.4,B
4301,2933,Michael J. Fox is extremely formal... ...he even shakes hands with his wife.,Did you hear about McDonald's trying to get into the steakhouse market? It was a big McSteak.,1.17,2.3,B
4901,1988,I hate how your family stops giving you money for your birthday as you get older. I need it more now than when I was 7 Auntie Barbara. I'm starving.,What do a viola and a lawsuit have in common? Everyone is happy when the case is closed.,3.1,2.0,A
6560,1248,"When I'm on the freeway I can't help but honk at the a-holes who don't like my violent, unpredictable driving.",I told my dad to embrace his mistakes. He cried. Then he hugged me and my brother.,2.16,3.39,B
2348,2460,"With the kids off at camp, my wife and I finally have some precious time to check Facebook in separate rooms.",The way to her heart: make her a bomb as sopita with limon and tapatio,2.5,1.17,A
278,3744,My new girlfriend told me I'm terrible in bed I told her it's unfair to make a judgement in less than a minute.,"""There's this baby, up in nursery. He's brand new. No one's neglected him or damaged him yet. How do we get from there to here?""",3.05,1.29,A
2366,5234,"Me: I cheated on you Wife: You had an affair with another woman? Me: No, I watched an episode of our TV show without you Wife: That's even worse",What's a Southeastern Asian business professional's favorite food? Tie food,2.75,1.65,A
3260,5673,The Rock had a baby girl today. I hope he names her Pebble.,"Lifehack: Binge watch a show in a fraction of the time by only watching the ""previously on..."" part at the start of each episode.",2.85,1.75,A
5111,5029,"Terrible office scheduling here. Somehow, Bring Your Dog to Work Day is on the same day as Wear Steak Pants to Work Day.","I picked up a hitchiker last night. He said ""thanks but how do you know I'm not a serial killer?"" I replied ""the chances of two serial killers being in the same car are astronomical""",1.9,3.35,B
1769,3301,How does a woman go about inventing something? She gives birth to a boy.,"A cobweb is just a spiderweb that has bacon, hard-boiled egg, and cheese in it.",2.39,0.94,A
122,1425,A parody of The Mandalorian but it’s The Mindalorian? Am I’m in the whole costume but doing Mindy-type stuff?,What do a prostitute and a plumber have in common? They both service the john.,0.56,2.9,B
6361,7468,"As a quiet and skinny person, I feel like we should charge loud and fat people more to ride the subway. It won't be difficult to implement either. All we would need to do is charge them by volume.","By legalizing Cannabis and; same-sex marriage we interpreted the bible correctly. ""A man who lays with another man should be stoned.""",1.38,2.67,B
3933,7227,"How many Germans does it take to change a lightbulb? Just one. They're an efficient people, but not very funny.","I started carrying a knife after an attempted mugging few years ago. Since then, my mugging attempts have been a lot more successful.",1.8,3.11,B
1902,5523,I wish I could see what it was like to be fat for just one day. I'm tired of being fat every day.,A Black man is driving down the motorway. He sticks his head out of the window. How does he die? Who gives a fuck? That's my fucking car.,3.6,1.6,A
5682,3016,What do you call a group of homosexual musicians from India who never get to play out? A Gay Raj band,Did you know that there are no canaries in the Canary Islands? And the same thing applies to the Virgin Islands; There are no canaries there either.,1.75,3.12,B
3802,4687,"Two gay guys are hanging out, and one says to the other, ""Hey, let's play hide and go seek! Loser gets fucked in the ass... I'll be behind the couch.""","I was in a taxi today and the driver said, ""I love my job. I'm my own boss. Nobody tells me what to do."" Then I said: ""Turn left here.""",2.0,3.0,B
6504,2273,"When dentists have a tv on the ceiling you can watch while they work on you, you forget about your fear of having your teeth drilled and focus on the fear of having a TV fall on your head.",How many muslims does it take to screw in a lightbulb? Sorry comments are unavailable on this joke.,2.68,1.2,A
2985,1352,"My Dad: I agree with Occam, the simplest explanation is usually the correct one Also My Dad: Apple changed my password again","A dad is given bad news by a doctor Doctor: Sir, I'm afraid your DNA is backwards. Dad: AND?",1.56,3.0,B
4736,3742,"I asked my wife what she wanted for her birthday. She said ""Nothing would make me happier than a pair of diamond earrings"" so I got her nothing",What do you call an overused tyre? Tyred.,3.1,1.9,A
4791,1123,What do you call a hen who counts her eggs? A mathemachicken.,"What is a rude way of referring to a young homosexual fly? A maggot, of course!",2.15,0.95,A
6603,4909,"I asked the librarian if the library had any books about paranoia. She whispered: ""They're right behind you.""","I truly hope there are people in France who believe that, in America, LeBron is known as TheBron.",3.3,2.29,A
880,6331,Only humans think it's easier to terraform a new planet than be a tiny bit accountable.,"I bought my wife some sexy lingerie. & as she tried it on, I couldn't help but think. It looked a lot fucking better on my girlfriend.",1.58,2.74,B
5125,2418,How many ants are needed to fill an apartment? Tenants,Give a white man a fish and he'll eat for a day. Give a black man a fishing rod and he'll fish your car keys through your letterbox.,2.7,1.28,A
4413,7997,What do pigs and ink have in common? They both belong in a pen.,Why are aspirins white? Because they work sorry,2.47,1.33,A
7094,6518,"A pirate's wife asks him what body part he'd be most okay with losing The pirate thinks and replies, ""my spine!"" ""Why?"" says his wife, a little surprised ""Because it's holding me back!""",me: hi can I get the price on this target cashier: [rips fire extinguisher from my hands] walmart said you'd be coming,3.15,1.26,A
3126,1154,Tried to pardon my turkey and he sued me for wrongful imprisonment and defamation.,"Today I shocked the hell out of the mailman by opening the door completely naked. I'm not sure what surprised him most: my nudity, or the fact that I know where he lives.",1.5,3.0,B
6108,1933,"It's frustrating when all the birthday cards at the store suck. Is it really too much to ask to be able to purchase a piece of cardboard with the exact words quantifying my very unique and very specific relationship with my wife for just $4.99? Get it together, Hallmark.",What do Irish feminists call men? O'Pressors,3.35,2.25,A
2985,732,"My Dad: I agree with Occam, the simplest explanation is usually the correct one Also My Dad: Apple changed my password again","Santa knows if I've been bad or good, so he and my browser history have a lot in common.",1.56,3.26,B
5025,349,If you Google 'How do I stop receiving Pottery Barn catalogs?' the top result is a page with instructions for faking your own death.,Q: What do peroxide blonds and black men have in common? A: They both have black roots.,3.26,2.2,A
707,1421,Me: Did you hear that Amazon has a new service where they'll be delivering Christmas trees? Wife: Oh really? That's cool. Me: They're calling it Amazon Pine. Wife: I want a divorce.,Hopefully no one ever sees those shorts I was actually wearing. Too Short 4 Dean Wheres The Beer Baby,2.68,0.71,A
974,6312,A dog may well be a man's best friend but a cat will never tell the police where your marijuana is.,What is the difference between a straight man's mustache and a gay man's mustache? The smell.,3.85,1.9,A
399,2118,teacher: alright today we have a speaker to talk about why drugs are bad me: [rollerblades through the door but i'm so high i run straight into the wall],What do a coffee shop and a Japanese castle siege have in common? Baristas,2.11,0.7,A
1026,3258,"How many male chauvinist does it take to change a lightbulb? None, the wife can cook fine in the dark",I was kidnapped by a gang of mimes. They threatened to do unspeakable things.,1.35,3.25,B
4463,5477,What was the first lie you remember telling your parents? For me it was either 'I don't know who started the fire' or 'I'm sure there won't be any fires at the next house we move to',Social media use among the young is getting worse. Latest research: 1 out of 3 teenagers today IS a phone.,2.37,1.22,A
6641,4066,interviewer: it says here you suffer from short term memory loss me: that's news to me,"Just burned 2,000 calories. That's the last time I leave brownies in the oven while I nap.",2.55,3.8,B
7321,2498,Right said Fred gets me every time! Haha. You go Deanmon now put a shirt on. What the hell?,I find a good way to warm up on a cold winter day is by giving myself anxious sweats thinking about the future of humanity.,0.3,2.62,B
3748,5279,I've recently developed a severe phobia of elevators. I'm taking steps to avoid them. corny,I've got 99 problems and bottles of beer on the wall are all of them.,3.2,2.1,A
4487,1758,Sometimes I think Gen Z is okay. And then I see how many people support 6ix9ine. 🤢,I WRITE ALL MY JOKES IN CAPITALS... THIS ONE WAS WRITTEN IN PARIS.,1.56,2.65,B
6600,1154,I just got hired at a company that makes bicycle wheels!! I'm the spokesperson.,"Today I shocked the hell out of the mailman by opening the door completely naked. I'm not sure what surprised him most: my nudity, or the fact that I know where he lives.",4.0,3.0,A
1181,4687,Me: how often do you feed the hippos? Zookeeper: several times a day Me: What kind of marbles do they eat? Zookeeper: white ones Me: nice,"I was in a taxi today and the driver said, ""I love my job. I'm my own boss. Nobody tells me what to do."" Then I said: ""Turn left here.""",1.44,3.0,B
4975,4163,"I've noticed that men who tell women to ""smile more"" rarely comply when politely asked to ""exist less.""",Me: What are you up to? Her: I'm making Chinese. Me: Cloning's unethical. Hahaha just kidding. Make me a math tutor.,2.69,1.68,A
3848,1401,"""Ex -boyfriends are just off limits to friends. I mean, that's just, like, the rules of feminism."" - Mean Girls","I was in the pub with the missus last night, and I said, ""I love you."" She said, "" Is that you or the beer talking?"" I replied, ""It's me, talking to the beer""...",1.7,2.7,B
2966,956,I wonder if Asian people put smileys like this ),When Chromatica II transitions to 911... I’ve never felt more gay and alive!!,2.3,0.1,A
1245,6129,They call them 'beer gardens' because 'people drinking in a parking lot' doesn't sound as classy,me: [as cute doctor walks in] i must have been poisoned by the mafia- doctor: says here you ate a glowstick,2.68,1.45,A
1135,2394,Why are redneck murders the hardest to solve? All the DNA matches and there's no dental records.,What do you call a 60-year old whose puberty just started? A late boomer.,3.33,2.3,A
5753,5267,"me: if santa is all knowing, then he could solve every crime but he just doesn't hostage: can i go to the bathroom me: no",Unvaccinated children are less likely to be autistic because they are more likely to be dead,1.06,2.46,B
3588,3345,What is the most effective way to quit being vegan? Cold turkey.,"How do you know if a Muslim is laughing online? He types, ""HALOL""",2.7,1.6,A
1902,1103,I wish I could see what it was like to be fat for just one day. I'm tired of being fat every day.,The reason you can't go back after going black is because none of them have a car to take you back or a job to buy gas.,3.6,2.05,A
1077,5379,"Black people are way more susceptible to diabetes. That's not racist, it's a medical fact. Now if I said ""hide your wallets, there's diabetes patients around here,"" that would be racist.",What does the sign on an out-of-business brothel say? Beat it. We're closed.,1.33,2.79,B
5995,5597,"One comma makes all the difference when telling someone, 'Diet, Dr. Pepper'",My wife caught me cheating last night and i feel so ashamed and full of regret. She's never going to play monopoly with me again!,1.32,3.55,B
5173,128,What do you get when you mix a Native American and an Irishman? An alcoholic with a drinking problem,"When I was a kid my mother stopped breast feeding me. I asked her why and she says ""hey, I just wanna be friends.""",1.55,2.75,B
5986,1692,This is the 47th wedding I've ruined. When I hit 50 I can retire. Conan And Friends https://t.co/RroiPVFp1m,We all know Albert Einstein was a genius... ...but his brother Frank was a monster.,1.95,3.0,B
481,2902,What do you call a group of confused Spanish speaking racists? The Qué Qué Qué,the hamburger helper implies the existence of a hamburger master,1.0,2.68,B
184,7660,*takes cute picture with child for Instagram *writes inspirational post about being a good parent while ignoring child for 45 mins,How do you confuse a 7 year old? Gay,2.33,0.89,A
204,4833,"professor: osmium is the densest material on earth, 22 grams in 1 cubic centimeter me: so you're saying- professor: [nodding] thicc as fuck",How sad to hear about mem fox . She is my boys favorite author. I guess possum magic is too extremist? Or 10 fingers and toes too diverse?,1.56,0.18,A
1675,6601,Fortune Nookie. Classic,"Breaking News: ""Masturbation helps prevent the common cold."" I bloody hope so, I've got no tissues left!",0.67,2.8,B
5667,6935,"My Asian roommate says I have schizophrenia. Jokes on him, I don't have a roommate.",I don't think Muslims go far enough in killing people who draw images of the prophet Mohammed. I think they should kill people who are named after him as well.,2.7,1.7,A
6086,2345,"Guy says, ""damn, there should be a law against having sex this good!"" The girl said nothing, for the drugs had left her unconscious.",How do sheep in Mexico say Merry Christmas? Fleece Navidad!,1.29,2.45,B
7902,2184,"If you run in front of a car you'll get tired, but if you run behind the car you'll get exhausted",My girlfriend calls it selective hearing. I prefer to call it drama filtering.,2.0,3.26,B
5077,3781,Good morning to ace twitter only,What do you call a helpful lemon? Lemonaid.,1.1,2.65,B
1318,1157,"Old people, when you say ""the good ol' days,"" do you mean during the draft, or when black people had separate bathrooms?",Lifehack: Protect yourself from identity theft by being a loser with bad credit and no money,1.75,3.28,B
1380,1189,"Abdul, my neighbour was crying... ""What's wrong?"" I asked. ""We lost our baby daughter, cot death"" he replied. ""Oh dear, that's so sad, never mind Abdul"" I said, ""just think of her as another virgin in paradise for your brave soldiers now""",My toothpaste says it guarantees whiteness within two weeks.. Yet after two weeks I'm still asian,0.88,2.85,B
7228,6569,What's the difference between a coyote and a flea? One howls on the prairie while the other prowls on the hairy.,"Why do all Asians think they're a celebrity in Rome? Every time someone says ""ciao"" they think they're taking about them",2.1,1.0,A
1537,5069,"My cousin is so poor.... that when she couldn't afford pay the Catholic church for her exorcism, they repossessed her.",criminal: oh no it's lobster man lobster man: [quickly sidestepping around them] move one inch and you get the pinch criminal: [takes out rubber bands] lobster man: oh god no,2.85,1.75,A
103,4984,Did you find it difficult being queer in a Black Greek Letter Org? Auntie Red Tweet Tea,I've never been more jealous of my brother who owns a big house. It must be amazing to have all those rooms where you can go to avoid your wife and kids.,0.27,1.85,B
4079,5517,Surprise someone who tries to fistbump you by shoving their entire hand in your mouth,[making out] ME: *grabs a blindfold from the nightstand* GIRLFRIEND: omg really? ME: *blindfolding the dog at the end of the bed* really.,1.63,2.9,B
5715,7594,"[2 am] *5 year old sneaks into my room* 5: (whispers) Daddy Me: .... 5: (louder) Daddy! Me: huh? what? 5: Are you asleep? Me: No... not anymore... 5: Okay, just checking. *goes back to bed*",What do the Egyptians call a man who cannot keep his opinions to himself? IMHOtep,3.0,1.6,A
