id_a,id_b,text_a,text_b,rating_a,rating_b,expected
3122,6040,"Want some juicy Hollywood gossip? After three drinks, I sometimes mispronounce 'Charlize Theron.'","My wife and I got married under a cell phone tower. The ceremony wasn't great, but the reception was perfect.",1.67,3.16,B
7403,7691,ME: It's not easy to make me laugh. I have a pretty refined sense of humor. ME: [when I see a picture of any animal wearing sunglasses] Ahahahahahahahahahahahahahahahahaha... hahahahahaha... hahahaha... heee heee... where'd you get those?,"The furniture store keeps calling me back, but all I wanted was that one nightstand.",2.05,3.25,B
852,5274,I deleted all the German contacts out of my phone... now its Hans free,"It isn't that I'm not going to watch the news tonight. Of course I'm watching the news tonight. It's just that I'm going to have a couple of stiff drinks and read *a lot* of Robert Benchley before I do, that's all.",2.55,1.47,A
6342,3737,"What did the Jewish pirate say when he heard his wife died? Argh, shiva me timbers",I couldn't figure out how the seat belt worked. Then it just clicked,1.63,2.65,B
3554,323,My wife said that if I don't get off the computer she'll slam my head on the keyboard... ....but I think she's jokinfjreoiwjrtwe4to8rkljreun8f4ny84c8y4t58lym4wthylmhawt4mylt4amlathnatyn,Welcome to your forties. Your eyebrows are now bushy enough you can see them without using a mirror.,3.35,2.06,A
577,7473,ME: Can you make sure I come back as something other than a human? DALAI LAMA: I am not in charge of that. ME: [slipping him $5] I'm tired of bathing.,I always leave my parents’ house five pounds heavier and ten years older.,1.4,2.65,B
6457,3078,"My parents said that if I got a tattoo I'd have to get it in a place that didn't matter... So I got it in Appleton, Wisconsin.",Immigrants are like sperm millions get in but only one works.,2.6,1.55,A
4884,7942,Q: What do you call a swimming pool full of blondes? A: Frosted Flakes.,"What does your mom and a rain forest have in common? If you look deep enough in the bush, you might find a cockatoo.",1.65,2.75,B
4940,7307,My ex-girlfriend is standing at the opposite end of the museum from me! I want to go say hi but there's just so much history between us.,What do you call the killing of Chinese baby girls? Youth-in-Asia,2.7,1.32,A
1143,3361,ME: True heroes are selfless. They do what's right and don't expect any credit. ALSO ME: My little brother should pay me a monthly gratuity for the rest of my life to thank me for teaching him about good music.,*Follows proper washing instructions on 10% of the clothes I own* It feels good to be the most adult person on Earth.,2.93,1.87,A
6705,1945,I lost my virginity to a retarded girl I wanted my first night to be special.,I threw a party for people who can't ejaculate. Nobody came.,1.9,2.9,B
7219,550,"Went on blind date, woke up in bathtub with kidney gone. 6 out of 10, would date again.","I saw my wife, slightly drunk, yelling at the TV: 'Don't go in there! Don't go in the church, you moron!' She's watching our wedding video again.",2.25,3.5,B
4969,7274,I just called the paranoia hotline. A guy answered: ' How hell did you get this number?!',"Robocop's costume was so bulky that it wouldn't fit into his police car when filming the movie. Every time you see Robocop driving, he's not wearing his Robo-Pants.",2.61,1.5,A
1439,6672,What is it called when one butt cheek is bigger than the other? Assymmetrical.,And then one day you realize you're older and fatter than old fat Elvis.,2.85,1.69,A
4018,2767,Did you know you cannot breath through the nose while you're smiling? Ha! I made you smile.,Anne Frank's dad actually edited her diary. He took out things about sex and dirty jokes.,3.11,1.64,A
2532,1290,I don't think the lady who just shushed a baby in the library knows how babies work,Q: Why did the lady and her attorney seek a scarlet frock as part of a settlement? A: Because she wanted a red dress for her grievances.,2.88,1.74,A
5625,4739,Love those first 2 weeks of the year where the gym is packed with people I'll never see again because I don't go back.,There is nothing wrong with exploring one's sexuality--and that is my message to the California Highway Patrol.,3.0,0.83,A
5697,7821,What do lesbians in Alaska sing? What would you do ew ew in a Klondike bar.,"Why would I use a Facebook app to see what I'd look like as a woman, when my wife's make-up and clothes are accessible whenever she goes to work",1.8,2.83,B
7877,550,her: we should break up me: why her: because you're too laid back about everything me: oh ok cool,"I saw my wife, slightly drunk, yelling at the TV: 'Don't go in there! Don't go in the church, you moron!' She's watching our wedding video again.",2.5,3.5,B
4661,4232,Yo momma's so fat... She got more chins than a Hong Kong phone book.,"After experimenting with lots of different drug and booze combinations, I finally discovered the Whisky, Valium and Heroin combo. Now the baby sleeps right through the night.",1.7,2.75,B
1305,7160,PIZZA GUY: Your total is $26.50 ME: I can't afford that PIZZA GUY: Well you'll have to pay some other way. ME: [takes out wallet] Wait I forgot I had 30 dollars. PORN DIRECTOR: Cut! What the fuck are you doing?,What does Arnold Schwarzenegger call a colonoscopy? A Cameron Diaz Say It Out Loud,2.55,0.56,A
1148,6445,They never prepare you in prenatal class for how weird looking your baby is going to be,What do you call an Arab man who drives a bus? A bus driver.,2.38,1.24,A
6032,1252,"If the whistle blower testifies to Congress, I hope he wears a referee's uniform.","Doctor: Relax, David. It's just a small surgery, don't panic. Me: But my name isn't David. Doctor: I know. I'm David.",2.11,3.2,B
2410,6642,"My dad once told me that if I put a potato in my swim trunks, I would attract more women... He forgot to tell me to put the potato in the front.","New Years Resolutions last week: Drink less, Get fit, Spend more time with my kids. New Years Resolutions this week: Spend less time drinking around my fit kids.",3.35,2.24,A
79,3310,"It's not my farting that bothers my wife, it's me yelling ""Release the Kraken!!"" right before I do it.",More like Yawn Steinbeck More like Lames Joyce More like O.K Rowling More like Plain Austen More like Ayn Bland More like Hackiavelli,2.6,0.83,A
5016,2352,"Compromise is so important. Like how I wanted to name our son ""Pat"" and my wife wanted to name him ""Rick"" so we met in the middle and went with ""Rickpat""",The worst thing about eating a clock... ....passing the time,1.84,2.95,B
6526,3045,"Drink plenty of water. The most common cause of kidney stones is not drinking enough fluids, especially water. kidney water","Damn, this is going to get ugly,"" I thought. As my wife removed her makeup.",0.6,2.65,B
6965,4898,My personal trainer told me my legs look like twizzlers. I assume by that he meant long and delicious.,Why was the white biologist considered racist? Because he wanted to preserve his culture h,2.9,1.75,A
5576,1425,Girl: Why are you so ugly? Boy: I'm you from the future.,What do a prostitute and a plumber have in common? They both service the john.,1.39,2.9,B
3704,5790,Everyone was excited to be at our autopsy club this evening. It was open Mike night.,my car: uh oh your seat belt isn't on haha beep beep me: my car: maybe i'll fuckin scream about it i dunno,3.25,1.63,A
877,5629,What's the most confusing day in a Mormon home? Mother's Day.,What do they call pita bread in Mexico? Pita pan,2.65,1.63,A
7432,1555,I asked my Ouija board when I was going to get a girlfriend and it spelled out HAHAHAHAHA until it caught fire.,What do transsexuals run on? Gender fluid.,3.25,1.95,A
4951,784,What's the difference between Santa Claus and a jew? Santa goes down the chimney christmas jokes,Finally my winter fat is gone... Now I have spring rolls.,1.53,3.0,B
2827,6333,Oh wow I guess Sheppy got ahold of my iPhone... sorry for the random Moana tweet 🤣,Why was Abraham Lincoln never put in jail? Because he was in a cent.,1.13,2.6,B
6759,1953,Did you know Hitler's father was a cobbler? He made Jews.,"I met a feminist in the bar, and she told me about the Dwayne Johnson rule. I should only say things to her that I would be comfortable saying to Dwayne Johnson. That sounded like a good rule, so I told her: ""Your chest is fucking epic.""",1.11,2.5,B
6811,949,"Astronaut 1: hey I can't find any milk for my coffee Astronaut 2: In space, no one can. Here, use cream.","My wife told me, ""Don't get upset if people call you fat…"" You're much bigger than that.",0.84,2.47,B
3284,5501,Luckily I never started vaping because there were many conclusive studies stating I would never look cool doing it.,ME IN NORMAL CLOTHES: I am nothing. I am invisible. ME THE SECOND I PUT ON A SCARF: I am a handsome rich millionaire who knows about horses. Make way.,1.88,2.89,B
5398,3481,eve: [eats an apple] god: [had no idea how he was going to explain childbirth] oh now guess what's your fault,What's black and white and black and white and black and white and black and white? A Penguin rolling down a hill What's black and white and laughing? The penguin who pushed him,1.75,2.9,B
5556,869,Weird. I've been hitting this wasp's nest with a wiffle ball bat for about five minutes and noth- ok I gotta go,What did the Mexican guy get for Christmas? His verdict.,2.65,1.32,A
6777,6224,How is a toddler like a cell phone? If you can't find it in three days it's probably dead.,"Push-ups? No, I'm just practicing my shoving.",3.0,1.85,A
3701,5477,"Hello sir, I'm from your internet provider. You recently said that ""homosexuality is wrong"", so we've blocked you from seeing lesbian porn.",Social media use among the young is getting worse. Latest research: 1 out of 3 teenagers today IS a phone.,2.5,1.22,A
3909,1874,Congrats Hugo Fernandez re: Great Lakes/Navy error. I bow to your expertise & Batmans self made cardboard utility belt,I got my best friend a fridge for her birthday. I can't wait to see her face light up when she opens it.,0.87,2.47,B
4803,7201,Black Friday? Isn't that the day when you can buy slaves at a discount?,"A Tibetan monk sees the face of Jesus in a tub of margarine. He raises his eyes to the heavens and said: ""I can't believe it's not Buddha!""",1.7,3.2,B
2316,1571,"Doctor: ""I'm just waiting for your X-Ray."" Blonde: ""I've never dated anyone named Ray.""","ME: So... you ever riddled a door? LOCKSMITH: What? ME: Like, there's a riddle, and if the person guesses the answer the door opens. LOCKSMITH: [Really loud] No that's crazy! *He silently ushers me into his truck and turns up the radio so we can have a private conversation*",2.3,1.06,A
2721,7942,"The days are getting shorter, but do they have to compensate by acting like assholes?","What does your mom and a rain forest have in common? If you look deep enough in the bush, you might find a cockatoo.",1.67,2.75,B
4988,6574,Statistics show that vegetarians live on average ten years longer than meat eaters. Ten long miserable years.,How many black people does it to pave a driveway? One. You just have to spread him real thin.,3.0,1.75,A
4522,7145,What do you call an Egyptian butt? A sphinxter,I bought a dictionary and when I got home I realized all the pages were blank; I have no words for how angry I am.,1.75,3.11,B
3682,6775,"My girlfriend peed her pants and asked me if she was still beautiful. I told her, ""urinate out of ten.""",Why did the bachelors purchase double amputee strippers for their party? Because they were 50% off!,2.9,1.55,A
5147,5805,"I'm seriously thinking about re-marrying my ex-wife, but I'm pretty sure she'll figure out I'm just after my money.","My jokes are like hot chicks Hard to get, and when you do they are not anywhere near as good as you thought they would be",3.35,2.0,A
1436,7275,I've learned a lot from movies. Like how in the 1970s if you wanted to develop a picture you had to turn on a red light and put a piece of paper in a tub of juice.,"My gay friend told me he's spending this 4/20 with his boyfriend. He said, ""After all, the Bible says 'Two men who lie together shall be stoned'.""",1.42,2.55,B
7511,527,"If the Founding Fathers were alive today, they'd probably win Dancing with the Stars. Those gentlemen were quite agile.",Got asked by two Thai girls if I wanted a threesome. They said it would be like winning the lottery. To my horror they were right: we had six matching balls.,1.05,2.9,B
300,7352,"My iPhone just autocorrected the word nigga to NIGGA, like whoa iPhone. You can't just go around yelling the N word. Jesus.",I buy my guns from a guy named T-Rex He's a small arms dealer.,2.16,3.5,B
2920,2296,After 40mins someone finally answered. Just to put me on hold for another 15mins LOL. They don't want to let go. GODDAMN THESE LOOKS OF MINE! 24 hour fitness,My wife and her sister got caught in a thunder shower on the way home from weight watchers earlier.... It was the funniest example of saturated fats I'd ever seen.,0.81,1.85,B
7191,221,What do Jewish women get when they go to the gynecologist? A pap schmear.,Two cheese trucks ran into each other. De brie was everywhere.,2.1,3.15,B
3213,2936,"I was on a plane about to crash when a female passenger shouted ""If I'm going to die, I want to die feeling like a woman... is there someone on this plane who is man enough to make me feel like a woman?"" So I stood up, removed my shirt and said ""Here, iron this""",What is a terrorist his favourite car? A Citroen C4 h,2.6,0.65,A
1079,5424,What do you call a homosexual in a wheelchair? Rolaids.,My Dad passed away last year when my family couldn't remember his blood type in time for the doctors to give him a blood transfusion. As he was dying he kept saying 'be positive' but it's really hard without him.,1.05,2.74,B
5058,5117,I busted my nose earlier today... I suppose women can call the aftermath a hot mess.,This morning I saw the milkman drinking a sip of milk before leaving it in front of my door. How dairy!?,0.59,2.4,B
6501,5795,I like my slaves like I like my coffee Strong and black,"The saying ""sick as a dog"" doesn't make any sense. Every dog is in much better shape than me, and I've never seen a dog watch 72 hours of Netflix because it had a runny nose.",1.56,3.0,B
6601,6721,"Breaking News: ""Masturbation helps prevent the common cold."" I bloody hope so, I've got no tissues left!",How do Jewish mothers prevent wrinkles? Oil of Oy Vey.,2.8,1.65,A
4966,1938,"I have never worked out the moral to Humpty Dumpty. Is it, 'don't let horses perform medical procedures?'",There's a German shepherd next door who keeps burying under my fence and shitting in the flower bed His dog is just as bad,1.63,2.89,B
3646,5379,This tweet is just a humblebrag that I can spell 'cantaloupe.',What does the sign on an out-of-business brothel say? Beat it. We're closed.,1.65,2.79,B
6222,322,I love waking up to the sound of birds arguing with their spouses.,It's only the fifth inning but both the Astros and the Dodgers just left early to beat the traffic.,2.95,1.94,A
843,6003,The only time I regret having 3 cats is fairly often.,Just seen an advert on TV by Gillette saying that they are easing the stress and pressure of shaving for men. I suggest that if you are a man that feels pressured and stressed from having a fucking shave then maybe you should consider waxing your vagina instead.,1.9,2.95,B
6492,271,"For me, home ownership largely consists of me identifying beeping sounds around the house and not knowing how to turn them off.",What do you call an Ethiopian with a dog? Stupid.,2.71,1.0,A
2118,6332,What do a coffee shop and a Japanese castle siege have in common? Baristas,"The past, the present, and the future walk into a bar... It was tense. haha",0.7,3.25,B
5440,3048,What do you call a girl who sets fire to bank loans? Bernadette.,11 y/o Daughter: [opens xmas present] uh..cable ties? Wife: she asked for a pony.. Me: a pony? ..SHE CAN'T EVEN LOOK AFTER HER CABLES LINDA,2.95,0.68,A
1026,2591,"How many male chauvinist does it take to change a lightbulb? None, the wife can cook fine in the dark","My wife likes it when I blow air on her when she's hot, but honestly...I'm not a fan.",1.35,2.55,B
1668,6133,"Hairdressers are not as good as they used to be. In the old days, barbers were that confident they had given you a good haircut, they would also sell condoms.",A girl walks into a bar and asks the bartender for a double entendre... so he gives it to her,2.4,1.11,A
2047,7091,"The most commonly spoken phrase this week in all homes - ""Do you have the Scotch tape?'",Why did the man open a rooftop bar? He wanted to have drinks on the house.,1.21,3.1,B
273,6627,"Why do only 10% of men make it to heaven? Because if they all went, it would be Hell.","Apparently, women in muslim countries can't drive. They can't do it here either.",2.7,1.65,A
2236,1814,I love jewish comedians they never ham it up.,A disadvantage of being gay is that you never get to see the grateful stare of a women you've just released.,2.1,1.07,A
1770,2089,Misspell one word and the whole text is urined,That blood donor clinic only wants you to donate plasma so they can make TVs out of it.,3.79,2.58,A
2337,1467,Wife: I think I've lost weight. My underwear don't fit anymore. They're all too big. Me: (flashback to when I was listening to natural woman and wearing her underwear) That's.... uh... awesome!,[first day as an exorcist] Boss exorcist: How's it going? Me: Really well! Have a look for yourself... *sees demons running on treadmills and lifting weights* Boss exorcist: I think you misunderstood what I meant by exorcise the demons,1.39,3.0,B
7666,5382,How long do you think it will take for gays to find out? That a gay marriage is as much an oxymoron as a gay funeral?,My brother got fired from his job because he had sex with one of his patients. Its a real shame as he was a great veterinarian,1.0,3.06,B
6610,1698,"Damn girl, are you a piñata? Cause imma need a blindfold to hit that.","The tongue weighs practically nothing, but yet so few people are actually strong enough to hold it",1.83,3.21,B
3976,5005,People say the back of my head looks really nice. But I don't see it.,What do Germans look at on the internet? Danke memes,2.74,1.65,A
1973,5980,How long does it take for a black woman to poop? Nine months.,"My parents said that if I got a tattoo I'd have to get it in a place that didn't matter. So I got it in Buford, Wyoming.",1.61,2.89,B
1342,1958,"FUN FACT for you movie buffs, the original title for Star Wars: A New Hope was Space Squabble: A Fresh Dollop of Good Vibes.","How can you tell the difference between a crocodile and an alligator? Easy, one will see you later, the other will see you in a while.",1.07,2.9,B
5355,4424,"After I changed sex, my daughter has been ignoring me.. It seems like I'm transparent",I’m laughing at these ladies waking up and being like Hey wanna become gay icons today?,2.28,1.0,A
6445,5755,What do you call an Arab man who drives a bus? A bus driver.,"Got fired from the market for being too violent. All I did was put out a sign that said, ""take lettuce from top of pile or heads will roll!""",1.24,2.85,B
880,2053,Only humans think it's easier to terraform a new planet than be a tiny bit accountable.,What do you call a rude German? A Deutsch bag,1.58,2.85,B
5029,4369,"I picked up a hitchiker last night. He said ""thanks but how do you know I'm not a serial killer?"" I replied ""the chances of two serial killers being in the same car are astronomical""",I like my coffee how I like my slaves... Free.,3.35,2.22,A
3668,5110,Whats the hardest part about cooking vegetables? Fitting the wheel chain in the oven.,The ocean is the best place for a depressed fisherman to see kelp.,1.05,2.75,B
576,550,Everybody changed their job titles to sound less threatening but not landlords. Those little lords still lordin' those lands.,"I saw my wife, slightly drunk, yelling at the TV: 'Don't go in there! Don't go in the church, you moron!' She's watching our wedding video again.",2.28,3.5,B
2578,1780,"A Mexican magician tells the audience he is going to disappear on the count of 3. He says ""uno, dos..."" and POOF! He disappeared without a tres.",What did the cheese say to itself in the mirror? Halloumi.,3.53,1.65,A
2567,5559,It's cool that they did the black hole or whatever but I'm more interested in BIG questions like: Why do I enjoy soup but I never have a craving for it?,A study conducted by a group of scientists shows that women that have more than 25% body fat live longer than the men who mention it to them,1.59,3.05,B
867,5,My brother waits till the last minute to steal packages off a porch.,Roses are dead. Love is fake. Weddings are basically funerals with cake.,1.18,2.78,B
2909,6203,What's the definition of endless love? Stevie Wonder and Ray Charles playing tennis.,I know several jokes in sign language. I guarantee nobody has ever heard them.,1.45,2.95,B
3428,7662,"To this day, no band has outdone The Beach Boys in singing about a car's technical specs.","Without fail, Instagram’s “you’re all caught up!” reminder sends deep into a dark place.",1.88,0.1,A
6984,2081,What do Nazi Germany and vaginas have in common? Their tendency to subjugate poles.,"If three men are arguing about whether to be known as Jews, Israelis, or Hebrews... ...would you say they're just arguing Semitics?",1.45,2.68,B
3705,7882,"ME: Wow, that documentary about WW2 was really intense. I'd like to watch more like that. NETFLIX ALGORITHM: May I suggest That 70's Show?",I dated a girl with a lazy eye once. It turns out she was seeing someone else on the side.,1.78,3.05,B
4383,7511,"Whenever you have to wear a name tag, make sure to draw a blue check mark beside your name so everyone knows it's really you and not some imposter","If the Founding Fathers were alive today, they'd probably win Dancing with the Stars. Those gentlemen were quite agile.",2.41,1.05,A
402,4419,me: [headbanging to the radio] my barber: fuckin stop it,"Today the Government's Furlough scheme has kicked in and now I am only receiving 80% of what I should be paid. Finally, I know what it feels like to be a woman.",3.11,1.63,A
4088,1587,Santa works one night a week then spends the rest of the year cranking out his podcast.,It's inappropriate to make a 'dad joke' if you're not a dad. It's a faux pa.,1.5,2.53,B
5383,5717,"When you feel sad, there's the one person who can show up and make you feel better... just wanna give a shout out to the pizza delivery guy.",ME: How do you know Cassiopeia is God's favorite constellation? *The planetarium security tries to wrestle the mic away from me* ME: He gave it five stars FOLKS!!!!,3.16,2.11,A
30,663,"What's a specimen? Mama mia, it's an Italian astronaut!","The US government once set a bunch of beer next to an atomic blast to see if it would still be drinkable after. Turns out, in the event of a nuclear war, beer is still safe to drink.",1.21,2.33,B
1790,427,Did you hear about the man who fell into the upholstery machine? He's fully recovered.,"The news is currently that spinning image of a newspaper, but it never stops spinning.",2.75,1.69,A
1156,7589,"How many dead whores does it take to change a light bulb? More than three, I still can't reach it.",What do you call a Communist sniper? A Marxman. corny,0.95,2.0,B
6480,5193,"If you need your iPhone repaired in Jerusalem, you obviously go to the Genius Bar. There, they don't serve alcohol..., ....but there's plenty of Apple Jews.",What is the official novel of Mexico? Tequila Mockingbird,1.25,2.58,B
850,6131,If we're going to arm the teachers at least give the librarians silencers.,Fairy Tale Trivia: The wolf in 3 Little Pigs and the wolf in Red Riding Hood were roommates at UC Santa Cruz.,3.33,1.42,A
6569,2973,"Why do all Asians think they're a celebrity in Rome? Every time someone says ""ciao"" they think they're taking about them",A Mexican got injured during a game of golf and needed stitches. I guess it was a hole in Juan.,1.0,2.15,B
6005,6265,Yesterday I spotted an albino dalmatian It was the least I could do for that dog.,What's the difference between a chick pea and a garbanzo bean? I've never had a garbanzo bean on my face. ROFL,2.78,1.7,A
5568,3126,"My ex-girlfriend just told me she wants us to get back together again. MAN! I sure am LUCKY! I mean, first I win the lottery and now THIS!",Tried to pardon my turkey and he sued me for wrongful imprisonment and defamation.,2.61,1.5,A
7797,4014,Why do pediatricians get so frustrated? They have very little patients. corny,Did you year about the chinese male prostitute? He'll give you a Bro-Job.,3.35,1.4,A
4333,5629,The inventor of knock knock jokes should win a no-bell prize.,What do they call pita bread in Mexico? Pita pan,3.0,1.63,A
2443,7511,"My girlfriend is weird, she always starts conversations with, ""Are you even listening to me!""","If the Founding Fathers were alive today, they'd probably win Dancing with the Stars. Those gentlemen were quite agile.",3.0,1.05,A
1243,5529,What did the nurse who knocked on the pregnant lady's door say? Womb Service!,A black man is speeding down the motorway and he dies. How? He sticks his head out of the window and his lips beat him to death.,2.6,1.16,A
37,4462,"I once interviewed for a position to become a blacksmith. They asked if I had ever shooed a horse. I said, ""No, but I've told a donkey to fuck off.""",I do believe that “pithy” is the faggiest word possible in existence.,2.53,0.8,A
6682,4398,How can you tell if a black guy is well hung? You can't fit your finger between the noose and his neck.,I just broke up with my blind girlfriend. We just didn't see eye to eye anymore.,1.58,2.85,B
6057,7158,Why are Mexicans called spics? Because they spic spanish.,"My boss touched me inappropriately at work today. Its okay though, i'm self-employed",1.65,2.9,B
